{
  "envelope_id": "env_abcdef01",
  "issued_at": "2026-01-07T00:00:00Z",
  "expires_at": "2026-01-07T00:15:00Z",
  "actor": {
    "spiffe_id": "spiffe://sourceos/inception",
    "aum_digest": "sha256:eeeeeeeeeeeeeeeeeeeeeeeeeeeeeeeeeeeeeeeeeeeeeeeeeeeeeeeeeeeeeeee"
  },
  "delegate": {
    "spiffe_id": "spiffe://sourceos/agent/semantic-broker",
    "aum_digest": "sha256:dddddddddddddddddddddddddddddddddddddddddddddddddddddddddddddddd"
  },
  "operation": "mcp.tool.invoke",
  "scope": [
    "capd://caps.audit.appendonly"
  ],
  "trust_boundary_id": "tb_mcp_fs_introspect_01",
  "grant_id": "grant_12345678",
  "policy_hash": "sha256:ffffffffffffffffffffffffffffffffffffffffffffffffffffffffffffffff",
  "constraints": {
    "paths_allow": ["$HOME/**"],
    "bytes_max": 50000000,
    "rate_per_min": 6
  },
  "sig": {
    "issuer": "spiffe://sourceos/policyarbiter",
    "sig": "MEUCIQDfakefakefakefakefakefakefakefakefakefakefakefake"
  },
  "evidence_refs": {
    "event_ir_ref": "worm://event-ir/e1",
    "event_ir_hash": "sha256:1111111111111111111111111111111111111111111111111111111111111111",
    "attestation_bundle_ref": "worm://attest/a1",
    "attestation_bundle_hash": "sha256:4444444444444444444444444444444444444444444444444444444444444444"
  }
}
